{
  "schema_id": "https://schemas.hermes-pipeline.dev/engineering/context-manifest/v1",
  "schema_version": 1,
  "manifest_id": "ctx_slice-00-02_executor_r3",
  "role": "EXECUTOR",
  "slice_id": "slice-00-02",
  "base_sha": "6c9623a3a8ad6a124d5d4a1bcddce94a5938e0b4",
  "assembled_at": "2026-08-05T09:09:43.285Z",
  "files": [
    {"path": "AGENTS.md", "digest": "sha256:884333bb1387c4abd448c1ee37e66b8d05549b9e1c9aea0bb94b256945edff4c", "purpose": "Repository constitution and authority boundaries"},
    {"path": "CONTEXT.md", "digest": "sha256:97960150474d5b0c2b459770f48299f4d897bb30b91f9de5f13d73d027d915b4", "purpose": "Canonical product and domain vocabulary"},
    {"path": "docs/agents/roles/executor.md", "digest": "sha256:46925379abdc01916be1faa690b0641737ef9cbe695d3930441f0f23a417ee17", "purpose": "Binding Executor role contract"},
    {"path": "docs/roadmap/TRACEABILITY.md", "digest": "sha256:cc858ef5387503b2154d59c0dc5ad7aeb934fb69e073d07ab53cf828271f1182", "purpose": "Phase requirement and verification traceability"},
    {"path": "docs/roadmap/phase-00-foundation/PHASE.md", "digest": "sha256:5acb46cdc68794bf69e5c708fb9813048f3d19170a7502f4f82a0f77de7d8f0d", "purpose": "Approved Phase 00 outcome, invariants, and exits"},
    {"path": "docs/roadmap/phase-00-foundation/phase-plan.json", "digest": "sha256:34035ae526cb363e8b8a009fbea7a0246dd87c33337f1086cf079cfa2d5aea3f", "purpose": "Approved Phase 00 machine plan"},
    {"path": "docs/roadmap/phase-00-foundation/slices/00-01-repository-baseline/CLOSEOUT.md", "digest": "sha256:9d365267fa747208bfef1d9c71b372045eec931fda67a222ac72c15bcb61b72d", "purpose": "Accepted predecessor capability, evidence, and debt"},
    {"path": "docs/roadmap/phase-00-foundation/slices/00-02-python-quality-skeleton/SLICE.md", "digest": "sha256:f7e2d7c1922eab9786fe0e5c0e3e97a4b7101032d50a6e68863e4a84e90efadb", "purpose": "READY human-readable Slice contract"},
    {"path": "docs/roadmap/phase-00-foundation/slices/00-02-python-quality-skeleton/slice-contract.json", "digest": "sha256:c7b6f024fd5124b20861b90d8be916be790324edf466bd3ebd74ef85622d0866", "purpose": "READY machine-valid Slice contract"},
    {"path": "docs/development/phase-and-slice-operating-model.md", "digest": "sha256:1f6e55ae6ede38d4eef94406fffece93f2b5d803ba208de3129ae1e2d3d1b5ad", "purpose": "Slice lifecycle, worktree, evidence, and review rules"},
    {"path": "docs/development/coding-and-test-standard.md", "digest": "sha256:b4d689f55b2d20c9fcbc9ba25578fb61471d970b49a5a91ddf50d6bab907b83a", "purpose": "Python coding and deterministic test standard"},
    {"path": "docs/development/ci-and-testing.md", "digest": "sha256:8953023372b964f8edecb5a68158677c3c9712d0d239219261c65782093496bf", "purpose": "CI, branch, test-layer, and release-gate rules"},
    {"path": "docs/development/compatibility-targets.md", "digest": "sha256:fda7f1049554814971ca24d6f9bfbddb64aa6584a36c609cf973e0d57f61fcdd", "purpose": "Python, uv, Git, Windows, and Linux targets"},
    {"path": "docs/architecture/system-and-module-design.md", "digest": "sha256:adabdcdf7b7673106510a45f867ab58fea48d3ebfc6114e74be95bead8fc986c", "purpose": "Package layout and enforceable import direction"},
    {"path": "docs/design/source-installation-and-update.md", "digest": "sha256:2dd8dcb0b25978172b7f7d4c44e6496531a14c168c5e9fa4f29f412301ba7c3a", "purpose": "Source, branch, release, and installation boundary"},
    {"path": "docs/adr/0018-separate-planning-and-integration-baselines.md", "digest": "sha256:ea6ba4c1ae3233a02e8929241eff282f88dc83f51984cc60629d460b9e5453e0", "purpose": "Planning and integration baseline separation"},
    {"path": "docs/adr/0020-use-python-312-and-uv-for-managed-runtime.md", "digest": "sha256:02c3403aeaed29563f0f3f3a25bf8e4a872b204cf88b5e5199b32daf00f9ba3e", "purpose": "Binding Python and uv environment decision"},
    {"path": "docs/adr/0024-use-pydantic-models-and-json-schema-contracts.md", "digest": "sha256:7e0c6c5b33113d11fe22d647d96d6eea7de9a683979c85b96dbe975e9cd073aa", "purpose": "Contract-source boundary deferred to Slice 00-03"},
    {"path": "scripts/check_documentation.py", "digest": "sha256:768c60c7e4280be978216417449b3e6b9d2080ca18eba23e04284eb081edacd1", "purpose": "Accepted checker requiring ignored-path correction"},
    {"path": "scripts/check_schemas.py", "digest": "sha256:dc213d0f303946f3593dfe66adb39cdb726b02ff354afe1fffec4c7b9c1c93a7", "purpose": "Bootstrap contract checker delegated by the CLI"},
    {"path": "schemas/engineering/context-manifest.schema.json", "digest": "sha256:6e3c354e6d5f7a1167d3c7e09d66f3369bb3fff80f7b6e1c35a852518e71a732", "purpose": "Context Manifest validation contract"},
    {"path": "schemas/engineering/execution-report.schema.json", "digest": "sha256:e0733dec906737170bffba0d82a2ca1e3c5ce4d09c5e4b88f9a659bb56c46ebf", "purpose": "Required Executor report contract"},
    {"path": "schemas/engineering/slice-contract.schema.json", "digest": "sha256:068e2ce358ecbb8330751e0ca4264d0e122021ad0843908902b6c6c24dc2aedd", "purpose": "Slice Contract validation contract"}
  ],
  "facts": [
    {"name": "assigned_worktree", "value": "C:/Users/a2691/AppData/Local/hermes/managed-worktrees/hermes-software-pipeline/slice-00-02", "source": "slice-contract.json"},
    {"name": "repository_read_scope", "value": "all tracked files", "source": "AGENTS.md and Executor role contract"},
    {"name": "manifest_semantics", "value": "governing context, not a read allowlist", "source": "phase-and-slice-operating-model.md"},
    {"name": "contract_revision", "value": 4, "source": "slice-contract.json"},
    {"name": "contract_hash", "value": "sha256:9b0fbb62936bd03a9f434d6570144b3771d7ced141e055f76df0360af04e6b2c", "source": "slice-contract.json canonical content hash"},
    {"name": "predecessor_candidate_sha", "value": "0d946abf73736d6a03c6b33433714c51b79dadaa", "source": "Slice 00-01 Closeout"},
    {"name": "predecessor_integrated_sha", "value": "6c9623a3a8ad6a124d5d4a1bcddce94a5938e0b4", "source": "Slice 00-01 Closeout and PR #1"},
    {"name": "managed_python", "value": ">=3.12,<3.13", "source": "ADR-0020 and compatibility-targets.md"},
    {"name": "uv_version", "value": "0.12.1", "source": "compatibility-targets.md and Slice discovery"},
    {"name": "branch_flow", "value": "feature pull request to main; signed tag publishes release", "source": "ci-and-testing.md"},
    {"name": "architecture_checker", "value": "Python standard-library AST", "source": "Planner decision"},
    {"name": "network_after_install_allowed", "value": false, "source": "slice-contract.json"},
    {"name": "credentials_allowed", "value": false, "source": "slice-contract.json"},
    {"name": "executor_git_mutation_allowed", "value": false, "source": "slice-contract.json"},
    {"name": "previous_review_findings", "value": "Standards P1 ambient Node, inverted Adapter direction, incomplete Controller boundary, unverifiable offline claim; Spec P1 incomplete CI/workflow validation and artifact audit; Spec P2 Python patch overstatement", "source": "Review attempt 1"}
  ],
  "content_hash": "sha256:67570ecae45f341a3e8686dcec9be1d5373501992ee7d6fe7614ad3f36fc9724"
}
